"","VALUE","Freq","EVT_NAME","LFRDB","EVT_FUEL","EVT_Fuel_N","EVT_LF","EVT_PHYS","EVT_GP","EVT_GP_N","SAF_SRM","EVT_ORDER","EVT_CLASS","EVT_SBCLS","R","G","B","RED","GREEN","BLUE","ACRES","REL_PERCENT"
"1",7011,841293,"Rocky Mountain Aspen Forest and Woodland",7011,2011,"Tr Rocky Mountain Aspen Forest and Woodland","Tree","Hardwood",602,"Aspen Forest, Woodland, and Parkland","SAF 217: Aspen","Tree-dominated","Open tree canopy","Deciduous open tree canopy",192,255,138,0.752941,1,0.541176,187099,0.6
"2",7012,6,"Rocky Mountain Bigtooth Maple Ravine Woodland",7012,2012,"Tr Rocky Mountain Bigtooth Maple Ravine Woodland","Tree","Hardwood",605,"Bigtooth Maple Woodland","SRM 418: Bigtooth Maple","Tree-dominated","Open tree canopy","Deciduous open tree canopy",171,255,138,0.670588,1,0.541176,1,0
"3",7016,1148630,"Colorado Plateau Pinyon-Juniper Woodland",7016,2016,"Tr Colorado Plateau Pinyon-Juniper Woodland","Tree","Conifer",630,"Pinyon-Juniper Woodland","SRM 504: Juniper-Pinyon Pine Woodland","Tree-dominated","Open tree canopy","Evergreen open tree canopy",121,255,94,0.47451,1,0.368627,255449,0.8
"4",7020,104,"Inter-Mountain Basins Subalpine Limber-Bristlecone Pine Woodland",7020,2020,"Tr Inter-Mountain Basins Subalpine Limber-Bristlecone Pine Woodland","Tree","Conifer",621,"Limber Pine Woodland","SAF 209: Bristlecone Pine","Tree-dominated","Open tree canopy","Evergreen open tree canopy",63,255,46,0.247059,1,0.180392,23,0
"5",7046,7,"Northern Rocky Mountain Subalpine Woodland and Parkland",7046,2046,"Tr Northern Rocky Mountain Subalpine Woodland and Parkland","Tree","Conifer",640,"Subalpine Woodland and Parkland","SAF 208: Whitebark Pine","Tree-dominated","Open tree canopy","Evergreen open tree canopy",191,255,233,0.74902,1,0.913725,2,0
"6",7049,2488524,"Rocky Mountain Foothill Limber Pine-Juniper Woodland",7049,2049,"Tr Rocky Mountain Foothill Limber Pine-Juniper Woodland","Tree","Conifer",621,"Limber Pine Woodland","SAF 219: Limber Pine","Tree-dominated","Open tree canopy","Evergreen open tree canopy",174,245,224,0.682353,0.960784,0.878431,553434,1.7
"7",7050,428576,"Rocky Mountain Lodgepole Pine Forest",7050,2050,"Tr Rocky Mountain Lodgepole Pine Forest","Tree","Conifer",622,"Lodgepole Pine Forest and Woodland","SAF 218: Lodgepole Pine","Tree-dominated","Closed tree canopy","Evergreen closed tree canopy",163,240,219,0.639216,0.941176,0.858824,95313,0.3
"8",7051,33241,"Southern Rocky Mountain Dry-Mesic Montane Mixed Conifer Forest and Woodland",7051,2051,"Tr Southern Rocky Mountain Dry-Mesic Montane Mixed Conifer Forest and Woodland","Tree","Conifer",625,"Douglas-fir-Ponderosa Pine-Lodgepole Pine Forest and Woodland","SAF 210: Interior Douglas-Fir","Tree-dominated","Closed tree canopy","Evergreen closed tree canopy",0,51,0,0,0.2,0,7393,0
"9",7052,39,"Southern Rocky Mountain Mesic Montane Mixed Conifer Forest and Woodland",7052,2052,"Tr Southern Rocky Mountain Mesic Montane Mixed Conifer Forest and Woodland","Tree","Conifer",643,"Douglas-fir-Grand Fir-White Fir Forest and Woodland","SAF 211: White Fir","Tree-dominated","Closed tree canopy","Evergreen closed tree canopy",0,204,0,0,0.8,0,9,0
"10",7054,381731,"Southern Rocky Mountain Ponderosa Pine Woodland",7054,2054,"Tr Southern Rocky Mountain Ponderosa Pine Woodland","Tree","Conifer",631,"Ponderosa Pine Forest, Woodland and Savanna","SAF 237: Interior Ponderosa Pine","Tree-dominated","Open tree canopy","Evergreen open tree canopy",214,255,181,0.839216,1,0.709804,84895,0.3
"11",7055,71706,"Rocky Mountain Subalpine Dry-Mesic Spruce-Fir Forest and Woodland",7055,2055,"Tr Rocky Mountain Subalpine Dry-Mesic Spruce-Fir Forest and Woodland","Tree","Conifer",639,"Spruce-Fir Forest and Woodland","SAF 206: Engelmann Spruce-Subalpine Fir","Tree-dominated","Closed tree canopy","Evergreen closed tree canopy",236,252,204,0.92549,0.988235,0.8,15947,0
"12",7056,8,"Rocky Mountain Subalpine Mesic-Wet Spruce-Fir Forest and Woodland",7056,2056,"Tr Rocky Mountain Subalpine Mesic-Wet Spruce-Fir Forest and Woodland","Tree","Conifer",639,"Spruce-Fir Forest and Woodland","SAF 206: Engelmann Spruce-Subalpine Fir","Tree-dominated","Closed tree canopy","Evergreen closed tree canopy",236,252,204,0.92549,0.988235,0.8,2,0
"13",7057,20675,"Rocky Mountain Subalpine-Montane Limber-Bristlecone Pine Woodland",7057,2057,"Tr Rocky Mountain Subalpine-Montane Limber-Bristlecone Pine Woodland","Tree","Conifer",621,"Limber Pine Woodland","SAF 209: Bristlecone Pine","Tree-dominated","Open tree canopy","Evergreen open tree canopy",63,255,46,0.247059,1,0.180392,4598,0
"14",7061,34934,"Inter-Mountain Basins Aspen-Mixed Conifer Forest and Woodland",7061,2061,"Tr Inter-Mountain Basins Aspen-Mixed Conifer Forest and Woodland","Tree","Conifer-Hardwood",603,"Aspen-Mixed Conifer Forest and Woodland","SAF 217: Aspen","Tree-dominated","Open tree canopy","Mixed evergreen-deciduous open tree canopy",192,255,138,0.752941,1,0.541176,7769,0
"15",7062,803470,"Inter-Mountain Basins Curl-leaf Mountain Mahogany Woodland",7062,2062,"Tr Inter-Mountain Basins Curl-leaf Mountain Mahogany Woodland and Shrubland","Tree","Conifer",628,"Mountain Mahogany Woodland and Shrubland","SRM 415: Curlleaf Mountain-Mahogany","Tree-dominated","Open tree canopy","Evergreen open tree canopy",155,235,216,0.607843,0.921569,0.847059,178687,0.5
"16",7064,25,"Colorado Plateau Mixed Low Sagebrush Shrubland",7064,2064,"Sh Colorado Plateau Mixed Low Sagebrush Shrubland","Shrub","Shrubland",623,"Low Sagebrush Shrubland and Steppe","SRM 405: Black Sagebrush","Shrub-dominated","Dwarf-shrubland","Evergreen dwarf-shrubland",204,182,135,0.8,0.713725,0.529412,6,0
"17",7066,9257738,"Inter-Mountain Basins Mat Saltbush Shrubland",7066,2066,"Sh Inter-Mountain Basins Mat Saltbush Shrubland","Shrub","Shrubland",636,"Salt Desert Scrub","SRM 501: Saltbush-Greasewood","Shrub-dominated","Dwarf-shrubland","Evergreen dwarf-shrubland",194,170,126,0.760784,0.666667,0.494118,2058871,6.3
"18",7072,5790965,"Wyoming Basins Dwarf Sagebrush Shrubland and Steppe",7072,2072,"Sh Wyoming Basins Dwarf Sagebrush Shrubland and Steppe","Shrub","Shrubland",623,"Low Sagebrush Shrubland and Steppe","SRM 405: Black Sagebrush","Shrub-dominated","Dwarf-shrubland","Evergreen dwarf-shrubland",204,182,135,0.8,0.713725,0.529412,1287880,3.9
"19",7080,44407485,"Inter-Mountain Basins Big Sagebrush Shrubland",7080,2080,"Sh Inter-Mountain Basins Big Sagebrush Shrubland","Shrub","Shrubland",604,"Big Sagebrush Shrubland and Steppe","SRM 403: Wyoming Big Sagebrush","Shrub-dominated","Shrubland","Evergreen shrubland",130,101,72,0.509804,0.396078,0.282353,9875987,30.1
"20",7081,1991614,"Inter-Mountain Basins Mixed Salt Desert Scrub",7081,2081,"Sh Inter-Mountain Basins Mixed Salt Desert Scrub","Shrub","Shrubland",636,"Salt Desert Scrub","SRM 414: Salt Desert Shrub","Shrub-dominated","Shrubland","Evergreen shrubland",156,128,92,0.611765,0.501961,0.360784,442924,1.4
"21",7086,285000,"Rocky Mountain Lower Montane-Foothill Shrubland",7086,2086,"Sh Rocky Mountain Lower Montane-Foothill Shrubland","Shrub","Shrubland",612,"Deciduous Shrubland","SRM 421: Chokecherry-Serviceberry-Rose","Shrub-dominated","Shrubland","Mixed evergreen-deciduous shrubland",117,87,61,0.458824,0.341176,0.239216,63382,0.2
"22",7102,1,"Colorado Plateau Pinyon-Juniper Shrubland",7102,2102,"Sh Colorado Plateau Pinyon-Juniper Shrubland","Shrub","Shrubland",699,"Pinyon-Juniper Shrubland","SRM 504: Juniper-Pinyon Pine Woodland","Shrub-dominated","Shrubland","Evergreen shrubland",121,255,94,0.47451,1,0.368627,0,0
"23",7106,24197,"Northern Rocky Mountain Montane-Foothill Deciduous Shrubland",7106,2106,"Sh Northern Rocky Mountain Montane-Foothill Deciduous Shrubland","Shrub","Shrubland",612,"Deciduous Shrubland","SRM 421: Chokecherry-Serviceberry-Rose","Shrub-dominated","Shrubland","Mixed evergreen-deciduous shrubland",117,87,61,0.458824,0.341176,0.239216,5381,0
"24",7107,26859,"Rocky Mountain Gambel Oak-Mixed Montane Shrubland",7107,2107,"Sh Rocky Mountain Gambel Oak-Mixed Montane Shrubland","Shrub","Shrubland",612,"Deciduous Shrubland","SRM 413: Gambel oak","Shrub-dominated","Shrubland","Mixed evergreen-deciduous shrubland",245,175,54,0.960784,0.686275,0.211765,5973,0
"25",7117,20,"Southern Rocky Mountain Ponderosa Pine Savanna",7117,2117,"Tr Southern Rocky Mountain Ponderosa Pine Savanna","Tree","Conifer",631,"Ponderosa Pine Forest, Woodland and Savanna","SAF 237: Interior Ponderosa Pine","Tree-dominated","Sparse tree canopy","Evergreen sparse tree canopy",214,255,181,0.839216,1,0.709804,4,0
"26",7125,22120347,"Inter-Mountain Basins Big Sagebrush Steppe",7125,2125,"Sh Inter-Mountain Basins Big Sagebrush Steppe","Shrub","Shrubland",604,"Big Sagebrush Shrubland and Steppe","SRM 314: Big Sagebrush-Bluebunch Wheatgrass","Shrub-dominated","Shrubland","Mixed evergreen-deciduous shrubland",230,151,41,0.901961,0.592157,0.160784,4919447,15
"27",7126,25016643,"Inter-Mountain Basins Montane Sagebrush Steppe",7126,2126,"Sh Inter-Mountain Basins Montane Sagebrush Steppe","Shrub","Shrubland",604,"Big Sagebrush Shrubland and Steppe","SRM 402: Mountain Big Sagebrush","Shrub-dominated","Shrubland","Mixed evergreen-deciduous shrubland",219,140,37,0.858824,0.54902,0.145098,5563567,17
"28",7127,2426265,"Inter-Mountain Basins Semi-Desert Shrub-Steppe",7127,2127,"Sh Inter-Mountain Basins Semi-Desert Shrub-Steppe","Shrub","Shrubland",613,"Desert Scrub","SRM 403: Wyoming Big Sagebrush","Shrub-dominated","Shrubland","Mixed evergreen-deciduous shrubland",130,101,72,0.509804,0.396078,0.282353,539588,1.6
"29",7135,2353290,"Inter-Mountain Basins Semi-Desert Grassland",7135,2135,"He Inter-Mountain Basins Semi-Desert Grassland","Herb","Grassland",617,"Grassland","SRM 502: Grama-Galetta","Herbaceous / Nonvascular-dominated","Herbaceous - grassland","Perennial graminoid grassland",255,200,125,1,0.784314,0.490196,523359,1.6
"30",7139,909589,"Northern Rocky Mountain Lower Montane-Foothill-Valley Grassland",7139,2139,"He Northern Rocky Mountain Lower Montane-Foothill-Valley Grassland","Herb","Grassland",617,"Grassland","SRM 311: Rough Fescue-Bluebunch Wheatgrass","Herbaceous / Nonvascular-dominated","Herbaceous - grassland","Perennial graminoid grassland",255,191,102,1,0.74902,0.4,202288,0.6
"31",7140,1596,"Northern Rocky Mountain Subalpine-Upper Montane Grassland",7140,2140,"He Northern Rocky Mountain Subalpine-Upper Montane Grassland","Herb","Grassland",617,"Grassland","SRM 312: Rough Fescue-Idaho Fescue","Herbaceous / Nonvascular-dominated","Herbaceous - grassland","Perennial graminoid grassland",255,184,97,1,0.721569,0.380392,355,0
"32",7141,283937,"Northwestern Great Plains Mixedgrass Prairie",7141,2141,"He Northwestern Great Plains Mixedgrass Prairie","Herb","Grassland",646,"Mixedgrass Prairie","SRM 606: Wheatgrass-Bluestem-Needlegrass","Herbaceous / Nonvascular-dominated","Herbaceous - grassland","Perennial graminoid grassland",255,176,92,1,0.690196,0.360784,63146,0.2
"33",7143,3,"Rocky Mountain Alpine Fell-Field",7143,2143,"He Rocky Mountain Alpine Fell-Field","Herb","Grassland",601,"Alpine Dwarf-Shrubland, Fell-field and Meadow","SRM 410: Alpine Rangeland","Herbaceous / Nonvascular-dominated","Herbaceous - grassland","Perennial graminoid grassland",171,145,106,0.670588,0.568627,0.415686,1,0
"34",7144,1,"Rocky Mountain Alpine Turf",7144,2144,"He Rocky Mountain Alpine Turf","Herb","Grassland",616,"Dry Tundra","SRM 410: Alpine Rangeland","Herbaceous / Nonvascular-dominated","Herbaceous - grassland","Perennial graminoid grassland",171,145,106,0.670588,0.568627,0.415686,0,0
"35",7145,273087,"Rocky Mountain Subalpine-Montane Mesic Meadow",7145,2145,"He Rocky Mountain Subalpine-Montane Mesic Meadow","Herb","Grassland",601,"Alpine Dwarf-Shrubland, Fell-field and Meadow","SRM 409: Tall Forb","Herbaceous / Nonvascular-dominated","Herbaceous - grassland","Perennial graminoid grassland",255,163,82,1,0.639216,0.321569,60733,0.2
"36",7146,624168,"Southern Rocky Mountain Montane-Subalpine Grassland",7146,2146,"He Southern Rocky Mountain Montane-Subalpine Grassland","Herb","Grassland",617,"Grassland","SRM 410: Alpine Rangeland","Herbaceous / Nonvascular-dominated","Herbaceous - grassland","Perennial graminoid grassland",171,145,106,0.670588,0.568627,0.415686,138812,0.4
"37",7148,112,"Western Great Plains Sand Prairie",7148,2148,"He Western Great Plains Sand Prairie","Herb","Grassland",647,"Sand Prairie","SRM 720: Sand Bluestem -Little Bluestem Dunes","Herbaceous / Nonvascular-dominated","Herbaceous - grassland","Perennial graminoid grassland",255,148,71,1,0.580392,0.278431,25,0
"38",7153,1813755,"Inter-Mountain Basins Greasewood Flat",7153,2153,"Sh Inter-Mountain Basins Greasewood Flat","Shrub","Shrubland",619,"Greasewood Shrubland","SRM 501: Saltbush-Greasewood","Shrub-dominated","Shrubland","Evergreen shrubland",194,170,126,0.760784,0.666667,0.494118,403369,1.2
"39",7166,415378,"Middle Rocky Mountain Montane Douglas-fir Forest and Woodland",7166,2166,"Tr Middle Rocky Mountain Montane Douglas-fir Forest and Woodland","Tree","Conifer",614,"Douglas-fir Forest and Woodland","SAF 210: Interior Douglas-Fir","Tree-dominated","Closed tree canopy","Evergreen closed tree canopy",0,51,0,0,0.2,0,92378,0.3
"40",7169,1,"Northern Rocky Mountain Subalpine Deciduous Shrubland",7169,2169,"Sh Northern Rocky Mountain Subalpine Deciduous Shrubland","Shrub","Shrubland",612,"Deciduous Shrubland","LF 41: Deciduous Shrubland","Shrub-dominated","Shrubland","Deciduous shrubland",128,97,69,0.501961,0.380392,0.270588,0,0
"41",7179,116,"Northwestern Great Plains-Black Hills Ponderosa Pine Woodland and Savanna",7179,2179,"Tr Northwestern Great Plains-Black Hills Ponderosa Pine Woodland and Savanna","Tree","Conifer",631,"Ponderosa Pine Forest, Woodland and Savanna","SAF 237: Interior Ponderosa Pine","Tree-dominated","Open tree canopy","Evergreen open tree canopy",214,255,181,0.839216,1,0.709804,26,0
"42",7250,134142,"Inter-Mountain Basins Curl-leaf Mountain Mahogany Shrubland",7062,2062,"Tr Inter-Mountain Basins Curl-leaf Mountain Mahogany Woodland and Shrubland","Shrub","Shrubland",628,"Mountain Mahogany Woodland and Shrubland","SRM 415: Curlleaf Mountain-Mahogany","Shrub-dominated","Shrubland","Mixed evergreen-deciduous shrubland",155,235,216,0.607843,0.921569,0.847059,29832,0.1
"43",7292,1595498,"Open Water",7292,11,"Ba Open Water","Water","Open Water",11,"Open Water","LF 11: Water","Non-vegetated","Non-vegetated","Non-vegetated",0,0,255,0,0,1,354830,1.1
"44",7295,206787,"Quarries-Strip Mines-Gravel Pits-Well and Wind Pads",7295,32,"Bab Quarries-Strip Mines-Gravel Pits-Well and Wind Pads","Barren","Quarries-Strip Mines-Gravel Pits-Well and Wind Pads",32,"Quarries-Strip Mines-Gravel Pits-Well and Wind Pads","LF 20: Developed","Non-vegetated","Non-vegetated","Developed",230,232,250,0.901961,0.909804,0.980392,45988,0.1
"45",7296,125208,"Developed-Low Intensity",7296,2902,"Bau Developed-Low Intensity","Developed","Developed-Low Intensity",22,"Developed-Low Intensity","LF 20: Developed","No Dominant Lifeform","No Dominant Lifeform","Developed",255,122,143,1,0.478431,0.560784,27846,0.1
"46",7297,71438,"Developed-Medium Intensity",7297,2903,"Bau Developed-Medium Intensity","Developed","Developed-Medium Intensity",23,"Developed-Medium Intensity","LF 20: Developed","No Dominant Lifeform","No Dominant Lifeform","Developed",253,44,79,0.992157,0.172549,0.309804,15887,0
"47",7298,23695,"Developed-High Intensity",7298,2904,"Bau Developed-High Intensity","Developed","Developed-High Intensity",24,"Developed-High Intensity","LF 20: Developed","No Dominant Lifeform","No Dominant Lifeform","Developed",173,0,28,0.678431,0,0.109804,5270,0
"48",7299,922469,"Developed-Roads",7299,2905,"Bau Developed-Roads","Developed","Developed-Roads",25,"Developed-Roads","LF 20: Developed","No Dominant Lifeform","No Dominant Lifeform","Developed",1,1,1,0.003922,0.003922,0.003922,205152,0.6
"49",7900,29988,"Western Cool Temperate Urban Deciduous Forest",7900,2913,"Dtd Urban Deciduous Forest","Tree","Developed",13,"Developed-Upland Deciduous Forest","LF 20: Developed","Tree-dominated","Open tree canopy","Deciduous open tree canopy",112,68,137,0.439216,0.266667,0.537255,6669,0
"50",7901,14326,"Western Cool Temperate Urban Evergreen Forest",7901,2914,"Dtc Urban Evergreen Forest","Tree","Developed",14,"Developed-Upland Evergreen Forest","LF 20: Developed","Tree-dominated","Open tree canopy","Evergreen open tree canopy",170,102,205,0.666667,0.4,0.803922,3186,0
"51",7902,1935,"Western Cool Temperate Urban Mixed Forest",7902,2915,"Dtm Urban Mixed Deciduous-Evergreen Forest","Tree","Developed",15,"Developed-Upland Mixed Forest","LF 20: Developed","Tree-dominated","Open tree canopy","Mixed evergreen-deciduous open tree canopy",194,158,215,0.760784,0.619608,0.843137,430,0
"52",7903,118286,"Western Cool Temperate Urban Herbaceous",7903,2916,"Dgr Urban Herbaceous","Herb","Developed",16,"Developed-Upland Herbaceous","LF 20: Developed","Herbaceous / Nonvascular-dominated","Herbaceous - grassland","Perennial graminoid",202,122,245,0.792157,0.478431,0.960784,26306,0.1
"53",7904,535116,"Western Cool Temperate Urban Shrubland",7904,2917,"Dsh Urban Shrubland","Shrub","Developed",17,"Developed-Upland Shrubland","LF 20: Developed","Shrub-dominated","Shrubland","Mixed evergreen-deciduous shrubland",207,171,215,0.811765,0.670588,0.843137,119007,0.4
"54",7920,869,"Western Cool Temperate Developed Deciduous Forest",7920,2908,"Dtd Developed Deciduous Forest","Tree","Developed",13,"Developed-Upland Deciduous Forest","LF 20: Developed","Tree-dominated","Open tree canopy","Deciduous open tree canopy",64,61,168,0.25098,0.239216,0.658824,193,0
"55",7921,2352,"Western Cool Temperate Developed Evergreen Forest",7921,2909,"Dtc Developed Evergreen Forest","Tree","Developed",14,"Developed-Upland Evergreen Forest","LF 20: Developed","Tree-dominated","Open tree canopy","Evergreen open tree canopy",102,119,205,0.4,0.466667,0.803922,523,0
"56",7922,2510,"Western Cool Temperate Developed Mixed Forest",7922,2910,"Dtm Developed Mixed Deciduous-Evergreen Forest","Tree","Developed",15,"Developed-Upland Mixed Forest","LF 20: Developed","Tree-dominated","Open tree canopy","Mixed evergreen-deciduous open tree canopy",68,79,137,0.266667,0.309804,0.537255,558,0
"57",7923,30367,"Western Cool Temperate Developed Shrubland",7923,2912,"Dsh Developed Shrubland","Shrub","Developed",17,"Developed-Upland Shrubland","LF 20: Developed","Shrub-dominated","Shrubland","Mixed evergreen-deciduous shrubland",122,142,245,0.478431,0.556863,0.960784,6753,0
"58",7924,5667,"Western Cool Temperate Developed Herbaceous",7924,2911,"Dgr Developed Herbaceous","Herb","Developed",16,"Developed-Upland Herbaceous","LF 20: Developed","Herbaceous / Nonvascular-dominated","Herbaceous - grassland","Perennial graminoid",158,170,215,0.619608,0.666667,0.843137,1260,0
"59",7960,121,"Western Cool Temperate Orchard",7960,2960,"Dab Orchard","Tree","Agricultural",60,"Agricultural-Orchard","LF 80: Agriculture","Tree-dominated","Open tree canopy","Deciduous open tree canopy",210,28,94,0.823529,0.109804,0.368627,27,0
"60",7961,1,"Western Cool Temperate Vineyard",7961,2961,"Da Vineyard","Agriculture","Agricultural",61,"Agricultural-Vineyard","LF 80: Agriculture","Shrub-dominated","Shrubland","Mixed evergreen-deciduous shrubland",168,0,132,0.658824,0,0.517647,0,0
"61",7963,273785,"Western Cool Temperate Row Crop - Close Grown Crop",7963,2963,"Da Row Crop - Close Grown Crop","Agriculture","Agricultural",63,"Agricultural-Row Crop-Close Grown Crop","LF 80: Agriculture","Herbaceous / Nonvascular-dominated","Herbaceous - grassland","Annual Graminoid/Forb",255,245,140,1,0.960784,0.54902,60888,0.2
"62",7964,348931,"Western Cool Temperate Row Crop",7964,2964,"Da Row Crop","Agriculture","Agricultural",64,"Agricultural-Row Crop","LF 80: Agriculture","Herbaceous / Nonvascular-dominated","Herbaceous - grassland","Annual Graminoid/Forb",250,255,119,0.980392,1,0.466667,77600,0.2
"63",7965,1469757,"Western Cool Temperate Close Grown Crop",7965,2965,"Da Close Grown Crop","Agriculture","Agricultural",65,"Agricultural-Close Grown Crop","LF 80: Agriculture","Herbaceous / Nonvascular-dominated","Herbaceous - grassland","Annual Graminoid/Forb",255,237,119,1,0.929412,0.466667,326866,1
"64",7966,394636,"Western Cool Temperate Fallow/Idle Cropland",7966,2966,"Dab Fallow/Idle Cropland","Herb","Agricultural",66,"Agricultural-Fallow/Idle Cropland","LF 80: Agriculture","Herbaceous / Nonvascular-dominated","Herbaceous - grassland","Annual Graminoid/Forb",255,255,119,1,1,0.466667,87765,0.3
"65",7967,4820770,"Western Cool Temperate Pasture and Hayland",7967,2967,"Dab Pasture and Hayland","Herb","Agricultural",67,"Agricultural-Pasture and Hayland","LF 80: Agriculture","Herbaceous / Nonvascular-dominated","Herbaceous - grassland","Annual Graminoid/Forb",227,212,28,0.890196,0.831373,0.109804,1072113,3.3
"66",7968,68730,"Western Cool Temperate Wheat",7968,2968,"Da Wheat","Agriculture","Agricultural",68,"Agricultural-Wheat","LF 80: Agriculture","Herbaceous / Nonvascular-dominated","Herbaceous - grassland","Annual Graminoid/Forb",250,227,163,0.980392,0.890196,0.639216,15285,0
"67",9001,73,"Colorado Plateau Mixed Bedrock Canyon and Tableland",9001,2001,"Sps Inter-Mountain Basins Sparsely Vegetated Systems","Sparse","Sparsely Vegetated",700,"Sparse Vegetation","LF 33: Sparsely Vegetated","No Dominant Lifeform","Sparsely vegetated","Sparsely vegetated",100,100,100,0.392157,0.392157,0.392157,16,0
"68",9004,235628,"Inter-Mountain Basins Active and Stabilized Dune",9004,2001,"Sps Inter-Mountain Basins Sparsely Vegetated Systems","Sparse","Sparsely Vegetated",700,"Sparse Vegetation","LF 33: Sparsely Vegetated","No Dominant Lifeform","Sparsely vegetated","Sparsely vegetated",100,100,100,0.392157,0.392157,0.392157,52402,0.2
"69",9005,1937,"Inter-Mountain Basins Alkaline Closed Depression",9005,2224,"He Inter-Mountain Basins Alkaline Closed Depression","Herb","Riparian",650,"Depressional Wetland","LF 56: Western Herbaceous Wetland","Herbaceous / Nonvascular-dominated","Herbaceous - grassland","Perennial graminoid grassland",250,100,56,0.980392,0.392157,0.219608,431,0
"70",9006,1375119,"Inter-Mountain Basins Cliff and Canyon",9006,2001,"Sps Inter-Mountain Basins Sparsely Vegetated Systems","Sparse","Sparsely Vegetated",700,"Sparse Vegetation","LF 33: Sparsely Vegetated","No Dominant Lifeform","Sparsely vegetated","Sparsely vegetated",100,100,100,0.392157,0.392157,0.392157,305819,0.9
"71",9008,608153,"Inter-Mountain Basins Playa",9008,2001,"Sps Inter-Mountain Basins Sparsely Vegetated Systems","Sparse","Sparsely Vegetated",700,"Sparse Vegetation","LF 33: Sparsely Vegetated","No Dominant Lifeform","Sparsely vegetated","Sparsely vegetated",100,100,100,0.392157,0.392157,0.392157,135250,0.4
"72",9009,2829415,"Inter-Mountain Basins Shale Badland",9009,2001,"Sps Inter-Mountain Basins Sparsely Vegetated Systems","Sparse","Sparsely Vegetated",700,"Sparse Vegetation","LF 33: Sparsely Vegetated","No Dominant Lifeform","Sparsely vegetated","Sparsely vegetated",100,100,100,0.392157,0.392157,0.392157,629247,1.9
"73",9011,846861,"North American Arid West Emergent Marsh",9011,2225,"He North American Arid West Emergent Marsh","Herb","Riparian",765,"Freshwater Marsh","LF 56: Western Herbaceous Wetland","Herbaceous / Nonvascular-dominated","Herbaceous - grassland","Perennial graminoid grassland",250,100,56,0.980392,0.392157,0.219608,188337,0.6
"74",9015,22,"Northwestern Great Plains Riparian Forest ",9015,2162,"Tr Western Great Plains Floodplain Systems","Tree","Riparian",635,"Western Riparian Woodland and Shrubland","LF 42: Great Plains Riparian","Tree-dominated","Open tree canopy","Deciduous open tree canopy",6,53,122,0.023529,0.207843,0.478431,5,0
"75",9016,171,"Rocky Mountain Alpine Bedrock and Scree",9016,2006,"Sps Rocky Mountain Alpine/Montane Sparsely Vegetated Systems","Sparse","Sparsely Vegetated",700,"Sparse Vegetation","LF 33: Sparsely Vegetated","No Dominant Lifeform","Sparsely vegetated","Sparsely vegetated",100,100,100,0.392157,0.392157,0.392157,38,0
"76",9017,119203,"Rocky Mountain Alpine-Montane Wet Meadow",9017,2176,"He Rocky Mountain Alpine-Montane Wet Meadow","Herb","Riparian",669,"Western Herbaceous Wetland","SRM 422: Riparian","Herbaceous / Nonvascular-dominated","Herbaceous - grassland","Perennial graminoid grassland",184,96,24,0.721569,0.376471,0.094118,26510,0.1
"77",9018,71158,"Rocky Mountain Cliff Canyon and Massive Bedrock",9018,2006,"Sps Rocky Mountain Alpine/Montane Sparsely Vegetated Systems","Sparse","Sparsely Vegetated",700,"Sparse Vegetation","LF 33: Sparsely Vegetated","No Dominant Lifeform","Sparsely vegetated","Sparsely vegetated",100,100,100,0.392157,0.392157,0.392157,15825,0
"78",9019,500566,"Rocky Mountain Lower Montane-Foothill Riparian Woodland",9019,2159,"Tr Rocky Mountain Montane Riparian Systems","Tree","Riparian",635,"Western Riparian Woodland and Shrubland","SAF 235: Cottonwood-Willow","Tree-dominated","Open tree canopy","Mixed evergreen-deciduous open tree canopy",73,171,186,0.286275,0.670588,0.729412,111323,0.3
"79",9021,109066,"Rocky Mountain Subalpine-Montane Riparian Shrubland",9021,2160,"Tr Rocky Mountain Subalpine/Upper Montane Riparian Systems","Shrub","Riparian",635,"Western Riparian Woodland and Shrubland","SRM 422: Riparian","Shrub-dominated","Shrubland","Mixed evergreen-deciduous shrubland",184,96,24,0.721569,0.376471,0.094118,24256,0.1
"80",9022,69401,"Rocky Mountain Subalpine-Montane Riparian Woodland",9022,2160,"Tr Rocky Mountain Subalpine/Upper Montane Riparian Systems","Tree","Riparian",635,"Western Riparian Woodland and Shrubland","SRM 422: Riparian","Tree-dominated","Open tree canopy","Mixed evergreen-deciduous open tree canopy",184,96,24,0.721569,0.376471,0.094118,15434,0
