"","VALUE","Freq","EVT_NAME","LFRDB","EVT_FUEL","EVT_Fuel_N","EVT_LF","EVT_PHYS","EVT_GP","EVT_GP_N","SAF_SRM","EVT_ORDER","EVT_CLASS","EVT_SBCLS","R","G","B","RED","GREEN","BLUE","ACRES","REL_PERCENT"
"81",9023,211,"Western Great Plains Badlands",9023,2007,"Sps Western Great Plains Sparsely Vegetated Systems","Sparse","Sparsely Vegetated",700,"Sparse Vegetation","LF 33: Sparsely Vegetated","No Dominant Lifeform","Sparsely vegetated","Sparsely vegetated",100,100,100,0.392157,0.392157,0.392157,47,0
"82",9024,26,"Western Great Plains Cliff and Outcrop",9024,2007,"Sps Western Great Plains Sparsely Vegetated Systems","Sparse","Sparsely Vegetated",700,"Sparse Vegetation","LF 33: Sparsely Vegetated","No Dominant Lifeform","Sparsely vegetated","Sparsely vegetated",100,100,100,0.392157,0.392157,0.392157,6,0
"83",9025,1,"Western Great Plains Closed Depression Wetland",9025,2495,"He Western Great Plains Depressional Wetland Systems","Herb","Riparian",650,"Depressional Wetland","SRM 601: Bluestem Prairie","Herbaceous / Nonvascular-dominated","Herbaceous - grassland","Perennial graminoid grassland",255,137,64,1,0.537255,0.25098,0,0
"84",9027,1,"Western Great Plains Open Freshwater Depression Wetland",9027,2495,"He Western Great Plains Depressional Wetland Systems","Herb","Riparian",650,"Depressional Wetland","SRM 601: Bluestem Prairie","Herbaceous / Nonvascular-dominated","Herbaceous - grassland","Perennial graminoid grassland",255,137,64,1,0.537255,0.25098,0,0
"85",9307,495286,"Great Basin & Intermountain Introduced Annual and Biennial Forbland",9307,2272,"He Great Basin & Intermountain Introduced Annual and Biennial Forbland","Herb","Exotic Herbaceous",704,"Introduced Annual and Biennial Forbland","LF 54: Introduced Upland Vegetation - Herbaceous","Herbaceous / Nonvascular-dominated","Herbaceous - grassland","Annual Graminoid/Forb",255,105,46,1,0.411765,0.180392,110149,0.3
"86",9308,901298,"Great Basin & Intermountain Introduced Annual Grassland",9308,2273,"He Great Basin & Intermountain Introduced Annual Grassland","Herb","Exotic Herbaceous",702,"Introduced Annual Grassland","LF 54: Introduced Upland Vegetation - Herbaceous","Herbaceous / Nonvascular-dominated","Herbaceous - grassland","Annual Graminoid/Forb",255,105,46,1,0.411765,0.180392,200444,0.6
"87",9309,645272,"Great Basin & Intermountain Introduced Perennial Grassland and Forbland",9309,2274,"He Great Basin & Intermountain Introduced Perennial Grassland and Forbland","Herb","Exotic Herbaceous",703,"Introduced Perennial Grassland and Forbland","LF 54: Introduced Upland Vegetation - Herbaceous","Herbaceous / Nonvascular-dominated","Herbaceous - grassland","Perennial graminoid grassland",255,105,46,1,0.411765,0.180392,143505,0.4
"88",9316,3,"Northern & Central Plains Ruderal & Planted Shrubland",9316,2567,"Sh Northern & Central Plains Ruderal & Planted Grassland & Shrubland","Shrub","Exotic Tree-Shrub",706,"Introduced Upland Vegetation-Shrub","LF 52: Introduced Upland Vegetation - Shrub","Shrub-dominated","Shrubland","Deciduous shrubland",255,105,46,1,0.411765,0.180392,1,0
"89",9327,97524,"Interior West Ruderal Riparian Forest",9327,2278,"Tr Interior West Ruderal Riparian Forest & Scrub","Tree","Riparian",701,"Introduced Riparian Vegetation","LF 58: Introduced Woody Wetlands and Riparian Vegetation","Tree-dominated","Open tree canopy","Mixed evergreen-deciduous open tree canopy",255,105,46,1,0.411765,0.180392,21689,0.1
"90",9328,239491,"Interior Western North American Temperate Ruderal Shrubland",9328,2279,"Sh Interior Western North American Temperate Ruderal Grassland & Shrubland","Shrub","Exotic Tree-Shrub",706,"Introduced Upland Vegetation-Shrub","LF 52: Introduced Upland Vegetation - Shrub","Shrub-dominated","Shrubland","Mixed evergreen-deciduous shrubland",255,105,46,1,0.411765,0.180392,53262,0.2
"91",9329,17197,"Western North American Ruderal Wet Shrubland",9329,2280,"Sh Western North American Ruderal Wet Shrubland Meadow & Marsh","Shrub","Riparian",708,"Introduced Woody Wetland Vegetation","LF 58: Introduced Woody Wetlands and Riparian Vegetation","Shrub-dominated","Shrubland","Mixed evergreen-deciduous shrubland",255,105,46,1,0.411765,0.180392,3825,0
"92",9336,1162088,"Great Basin & Intermountain Ruderal Shrubland",9336,2282,"Sh Great Basin & Intermountain Ruderal Shrubland","Shrub","Exotic Tree-Shrub",706,"Introduced Upland Vegetation-Shrub","LF 52: Introduced Upland Vegetation - Shrub","Shrub-dominated","Shrubland","Mixed evergreen-deciduous shrubland",255,105,46,1,0.411765,0.180392,258442,0.8
"93",9515,23,"Northwestern Great Plains Riparian Shrubland",9015,2162,"Tr Western Great Plains Floodplain Systems","Shrub","Riparian",635,"Western Riparian Woodland and Shrubland","LF 42: Great Plains Riparian","Shrub-dominated","Shrubland","Mixed evergreen-deciduous shrubland",6,53,122,0.023529,0.207843,0.478431,5,0
"94",9516,80,"Northwestern Great Plains Riparian Herbaceous",9015,2162,"Tr Western Great Plains Floodplain Systems","Herb","Riparian",669,"Western Herbaceous Wetland","LF 42: Great Plains Riparian","Herbaceous / Nonvascular-dominated","Herbaceous - grassland","Perennial graminoid grassland",6,53,122,0.023529,0.207843,0.478431,18,0
"95",9519,1068520,"Rocky Mountain Lower Montane-Foothill Riparian Shrubland",9019,2159,"Tr Rocky Mountain Montane Riparian Systems","Shrub","Riparian",635,"Western Riparian Woodland and Shrubland","SAF 235: Cottonwood-Willow","Shrub-dominated","Shrubland","Mixed evergreen-deciduous shrubland",73,171,186,0.286275,0.670588,0.729412,237633,0.7
"96",9816,76,"Northern & Central Plains Ruderal & Planted Grassland",9316,2567,"Sh Northern & Central Plains Ruderal & Planted Grassland & Shrubland","Herb","Exotic Herbaceous",703,"Introduced Perennial Grassland and Forbland","LF 54: Introduced Upland Vegetation - Herbaceous","Herbaceous / Nonvascular-dominated","Herbaceous - grassland","Perennial graminoid grassland",255,105,46,1,0.411765,0.180392,17,0
"97",9827,213743,"Interior West Ruderal Riparian Scrub",9327,2278,"Tr Interior West Ruderal Riparian Forest & Scrub","Shrub","Riparian",701,"Introduced Riparian Vegetation","LF 58: Introduced Woody Wetlands and Riparian Vegetation","Shrub-dominated","Shrubland","Mixed evergreen-deciduous shrubland",255,105,46,1,0.411765,0.180392,47535,0.1
"98",9828,277946,"Interior Western North American Temperate Ruderal Grassland",9328,2279,"Sh Interior Western North American Temperate Ruderal Grassland & Shrubland","Herb","Exotic Herbaceous",703,"Introduced Perennial Grassland and Forbland","LF 54: Introduced Upland Vegetation - Herbaceous","Herbaceous / Nonvascular-dominated","Herbaceous - grassland","Perennial graminoid grassland",255,105,46,1,0.411765,0.180392,61814,0.2
"99",9829,145960,"Western North American Ruderal Wet Meadow & Marsh",9329,2280,"Sh Western North American Ruderal Wet Shrubland Meadow & Marsh","Herb","Riparian",709,"Introduced Herbaceous Wetland Vegetation","LF 59: Introduced Herbaceous Wetland and Riparian Vegetation","Herbaceous / Nonvascular-dominated","Herbaceous - grassland","Perennial graminoid grassland",255,105,46,1,0.411765,0.180392,32461,0.1
